{"artifact_class":"exp001-comparative-response-index","model_id":"Qwen/Qwen2.5-0.5B","protocol_id":"exp001-reference-comparative-v1.0.0","record_count":85,"records":[{"prompt_sha256":"af6f0ef7ef1ff55f419fe3a6736871fe4ba3441fb54e8ab88d4b8f48e2f17072","record_id":"agri-irrigation-1-transfer-blinded","scores":{"A":-2.499962024746715,"B":-3.225006275234996,"C":-4.898777179776012,"D":-5.047341518460094}},{"prompt_sha256":"c72f6279b603347bf6ff3d2d930e9604f54b8cd31e2f76aed1f8d7bf708008c9","record_id":"agri-irrigation-1-lexical-control","scores":{"A":-1.8112977491211701,"B":-2.8306611524414826,"C":-4.338930462439041,"D":-4.468977306921463}},{"prompt_sha256":"b882af1f5074d72b50cf0724cc0b2bb64923fb60bf602ce9d1ba4cdb46ce9cb4","record_id":"agri-irrigation-1-transfer-exposed","scores":{"A":-2.865285950205042,"B":-3.5341339879247684,"C":-5.164773064157679,"D":-5.045269089243128}},{"prompt_sha256":"056c27d9df0064a817a993957fc1ab5d8c7ce63899eb087a2a7bce6ff0ed2fe9","record_id":"agri-irrigation-2-transfer-blinded","scores":{"A":-2.4470350487901094,"B":-2.9279520257188203,"C":-4.430251334495676,"D":-4.42186186153425}},{"prompt_sha256":"347693034b6a2f55bbb61a8cfa4498267c7409a4b7f2ec610f4c3c39b17fdb94","record_id":"agri-irrigation-2-lexical-control","scores":{"A":-2.0035888489497182,"B":-3.177399807812023,"C":-4.441086941601085,"D":-4.906469517589855}},{"prompt_sha256":"ce4cbc8bd33c9074413994b8929a3f537403107daa76004d796c1d6d0b2fa184","record_id":"agri-irrigation-2-transfer-exposed","scores":{"A":-2.9626232435444777,"B":-3.47186816236772,"C":-5.111730222914595,"D":-4.963614111159224}},{"prompt_sha256":"72ef725df849c76682e6e42ab6449874eda4df7e9aef4ba3b4a5e582ffb67523","record_id":"agri-microclimate-1-transfer-blinded","scores":{"A":-2.4908378627033763,"B":-3.4875591304035716,"C":-4.860838701936775,"D":-4.715166857454353}},{"prompt_sha256":"3b411f2f634ac429a2990168d5f20fdae95034d29e9a8ab6e8f03adb1c23efdd","record_id":"agri-microclimate-1-lexical-control","scores":{"A":-2.1787977590673364,"B":-3.7152529134862817,"C":-4.314837492954055,"D":-4.927395857822219}},{"prompt_sha256":"8f83bcc4f6611a2cfacf213ae2b968543aa0392b1cc150ef2cc600f8f4ccf068","record_id":"agri-microclimate-1-transfer-exposed","scores":{"A":-3.2495671911186648,"B":-3.955640952104993,"C":-5.062825362200208,"D":-4.819898764604993}},{"prompt_sha256":"b008cc9936a603fe63b0e893d15353a11bd2e9e6b60a97ba0ebf660e0361646f","record_id":"agri-microclimate-2-transfer-blinded","scores":{"A":-2.1824247451846723,"B":-3.188614091498149,"C":-4.215970239264262,"D":-4.563380441290629}},{"prompt_sha256":"0eb4b0975143397de7c157f7e6ef6ddfacb28b16444512f76706daad7f134914","record_id":"agri-microclimate-2-lexical-control","scores":{"A":-1.7384966888750668,"B":-3.210420517000067,"C":-4.228966621431219,"D":-4.399167923005926}},{"prompt_sha256":"c866f4bc36e15499db3a2b0df343df384b6a462f14e5ca3e233d84f291b3234f","record_id":"agri-microclimate-2-transfer-exposed","scores":{"A":-2.7125023283935903,"B":-3.7957619109131215,"C":-4.8767746367432,"D":-4.96101364278568}},{"prompt_sha256":"a334490b92645cbe551de7b17c202b1d5cc746fe86aeeda0a41d78caf0c640dd","record_id":"med-implant-1-transfer-blinded","scores":{"A":-2.293387907526103,"B":-3.2493872819157517,"C":-4.617014425775615,"D":-5.0605511841984665}},{"prompt_sha256":"fdc92d9aa8c03e3f0d6f93c974662f62d729ed07d01d4d3bac37a738b78d322d","record_id":"med-implant-1-lexical-control","scores":{"A":-2.2662978385992645,"B":-3.2137274955816864,"C":-4.540628931433737,"D":-5.243885538489401}},{"prompt_sha256":"36eb5d7c8e82f1d2d159eadabb0998ed71cac28cd4a06c1948b4852b5d5e4e73","record_id":"med-implant-1-transfer-exposed","scores":{"A":-2.815797364785002,"B":-3.6778521896141037,"C":-5.130206620766447,"D":-5.333205735756682}},{"prompt_sha256":"4f39c8413a3f020014148fdaea5a3af0f0aaebd4a922c8a1641ca4a4fe139278","record_id":"med-implant-2-transfer-blinded","scores":{"A":-2.310140126353417,"B":-3.207946293955956,"C":-4.613792889720116,"D":-4.958339207774316}},{"prompt_sha256":"a76527b8bcdd4c3e9552eec92c0852fc017fe9ad38c015d70633d86c2a90a6ce","record_id":"med-implant-2-lexical-control","scores":{"A":-2.4841295017048672,"B":-3.0633207095906094,"C":-4.666974617366488,"D":-5.1549535526081876}},{"prompt_sha256":"dfc4bc447d45ec163bd38e78dd5d19deb5b96cd1ad78a37a07677818155005d2","record_id":"med-implant-2-transfer-exposed","scores":{"A":-3.0964323835796392,"B":-3.635527308506397,"C":-5.122479136509327,"D":-5.374601061863331}},{"prompt_sha256":"5d7501db0998b40303b199457f76ac5b2266a897fc8c478ad555ecd3bdb80d69","record_id":"med-monitoring-1-transfer-blinded","scores":{"A":-2.2419139496635587,"B":-3.4454700104545743,"C":-4.884430085832992,"D":-4.99309459846727}},{"prompt_sha256":"fb53827b59ef5cd07498bb423d4ddaac74bfc82721b63a5193348d6e5860a01d","record_id":"med-monitoring-1-lexical-control","scores":{"A":-2.002334563957298,"B":-3.4289264371262433,"C":-4.565613715873802,"D":-4.881859748588646}},{"prompt_sha256":"41a1c3640b71df6cf236548fe61b8ce382447775f52a9644449a7ebf0cdd22e2","record_id":"med-monitoring-1-transfer-exposed","scores":{"A":-2.8958228763737246,"B":-3.9149478611149355,"C":-5.293177002350287,"D":-5.09444844094892}},{"prompt_sha256":"93ea53fe25a95e3b11ee26d996af7d2cc49fe51e5042c0661766640bbe012347","record_id":"med-monitoring-2-transfer-blinded","scores":{"A":-2.2094239205161266,"B":-3.247036835555189,"C":-4.46889676750099,"D":-4.228163620833509}},{"prompt_sha256":"78a8512cf838cdb3a70bcbd2ab7b119559512fa4876ee7a8cfa285a9df3c88ed","record_id":"med-monitoring-2-lexical-control","scores":{"A":-2.3017247689755926,"B":-3.4509156716855536,"C":-4.857988692620612,"D":-4.600833274224616}},{"prompt_sha256":"c06454e901a255164a752b411c7dc0ac50fcdbb940214566a228cdf8b58ab4f7","record_id":"med-monitoring-2-transfer-exposed","scores":{"A":-2.873217158496587,"B":-3.7842011978032275,"C":-5.08786635893604,"D":-4.7358308364751025}},{"prompt_sha256":"9a3dbaa3fa30afbe3a8c6d93d2053b61d9deac7142f1a4c85429a7850b58e6bf","record_id":"mfg-multifunction-1-transfer-blinded","scores":{"A":-1.8163632363854845,"B":-3.1321572274743517,"C":-4.288917443233629,"D":-4.644118210750719}},{"prompt_sha256":"075e27a9ad9f94f5156047a15472c749f4c2539bd1e9b287aa5c9c03e8b9fdbe","record_id":"mfg-multifunction-1-lexical-control","scores":{"A":-2.1049233166963006,"B":-3.5480271069795037,"C":-4.591838905075207,"D":-4.889009544113293}},{"prompt_sha256":"02fc8db0b5b7cd89eedc411ed07f2e1feff276061e27d60bb22a3e316b8260a0","record_id":"mfg-multifunction-1-transfer-exposed","scores":{"A":-2.477188042039188,"B":-3.505660942429813,"C":-4.641365936631473,"D":-5.1371926578228795}},{"prompt_sha256":"45150b28fe69811e1173499105e1ef9a8f8ab1d13376939787f1f66957a93535","record_id":"mfg-multifunction-2-transfer-blinded","scores":{"A":-2.4325717739843924,"B":-3.0759414486670096,"C":-4.637169247128924,"D":-4.829830532529314}},{"prompt_sha256":"b08c2189e6ea521d263765bcbae08586a22586bc615749cfd9a7ebd3bc593093","record_id":"mfg-multifunction-2-lexical-control","scores":{"A":-2.514493432241867,"B":-3.6786083843292694,"C":-4.952465501028488,"D":-5.428999390798996}},{"prompt_sha256":"372dedb07c2e29a976edc9ff5c9e985b67ba59cd4360af38a13e5c8e4bdee987","record_id":"mfg-multifunction-2-transfer-exposed","scores":{"A":-2.9743676756215187,"B":-3.257965621788511,"C":-4.963725623924741,"D":-5.122792777855405}},{"prompt_sha256":"fdab8aff3ac63f32a95597112494224c55d6997c271d81511c9c0aff5f41961f","record_id":"mfg-compensation-1-transfer-blinded","scores":{"A":-2.186478629171223,"B":-3.2402410650843088,"C":-4.101790442525715,"D":-4.543830885946125}},{"prompt_sha256":"d4c1ae508cc87d75317baa8b49e61292a8b9a6e2c6daa8b029b456153273dd77","record_id":"mfg-compensation-1-lexical-control","scores":{"A":-2.0727774371055396,"B":-3.4398314227012428,"C":-4.945175813570383,"D":-5.100032495394114}},{"prompt_sha256":"761fcce26838f1925125857b3a83bc4681461507b9ed5457c4578da9698ea982","record_id":"mfg-compensation-1-transfer-exposed","scores":{"A":-2.689100758703969,"B":-3.677774922522328,"C":-4.481826321753285,"D":-4.813141362341664}},{"prompt_sha256":"9595e0fec8399e019143772edd850daafe190fd8278ceb58eb644d07e35fee9c","record_id":"mfg-compensation-2-transfer-blinded","scores":{"A":-2.2573326000502476,"B":-3.5676467785170445,"C":-4.336869038038529,"D":-4.290797985487259}},{"prompt_sha256":"e44359d8dd330139a603144b72d8167a1fe9ae1e98733009a1140b8e4b4dab49","record_id":"mfg-compensation-2-lexical-control","scores":{"A":-2.166842876376961,"B":-3.4893698081396565,"C":-4.625103412570809,"D":-4.751136241855477}},{"prompt_sha256":"40221af4301423b1a8b2dd88bd3377d27af1f3269fa68743115bc41dcd364ba5","record_id":"mfg-compensation-2-transfer-exposed","scores":{"A":-2.8683005891730176,"B":-4.23905673846501,"C":-4.922084959595381,"D":-4.686694296448408}},{"prompt_sha256":"9b7001f28caf05f8cbc52b1c51a9402985d126c93ae0ac652daf774852ad4318","record_id":"log-dimension-1-transfer-blinded","scores":{"A":-2.6744454432561717,"B":-3.2680028010442577,"C":-4.49290876875666,"D":-4.576031975848945}},{"prompt_sha256":"b5f445a933a43e122ab598f20ce8aae7bcf74dc8cf290df26dd51800f422b5b4","record_id":"log-dimension-1-lexical-control","scores":{"A":-1.995059877901216,"B":-3.55817976620688,"C":-5.105963617830415,"D":-5.080239206819673}},{"prompt_sha256":"78afbdceec55ab91f1dd2682b7f07711104708a864e00d690d505ab36b2d39d5","record_id":"log-dimension-1-transfer-exposed","scores":{"A":-3.1922778242206604,"B":-3.733482276735309,"C":-5.367020522890094,"D":-5.30611125164986}},{"prompt_sha256":"ca3e71665b99ddffa749550068955063739824be8e7cd2c7aadccc580a3603e9","record_id":"log-dimension-2-transfer-blinded","scores":{"A":-2.262456810173532,"B":-3.2903269883961883,"C":-4.291873848137399,"D":-4.627110397514841}},{"prompt_sha256":"f2fc2e31fa7d69e3b41967ebd14e03fa737b995b5c2d3797e226c7ca7d30786c","record_id":"log-dimension-2-lexical-control","scores":{"A":-2.288576202560204,"B":-3.7004681398160635,"C":-4.597302513290185,"D":-5.165226059127587}},{"prompt_sha256":"35d8d1cc302a6f93c1be4ca786d196aff2924fcd6e1691ce1051b109564e97f9","record_id":"l